row_id,submission_TITLE,HIGHLIGHTED THEME (OPTIONAL),submission_ABSTRACT,KEYWORDS_SELECTION
1,Evaluating the effect of frame rate in sequence-based classification of autism-related self-stimulatory hand idiosyncrasies,"Telehealth, Wearable Devices, and Patient-Generated Health Data: The New Frontiers of Informatics","Autism spectrum disorder (ASD) affects a substantial population globally, necessitating efficient, scalable, and accessible detection methods. While machine learning offers promise, conventional CNN models have the propensity to overfit when trained on small datasets. In this study, we evaluated two models: an LSTM-based and a faster GRU-based model on the SSBD dataset. Both outperformed CNN models, with peak accuracies of 97.5% (LSTM) and 98.75% (GRU) achieved when sampling videos every 15 frames. We further find that sampling every other frame performs optimally compared with other sampling rates. Our work demonstrates the potential for low-parameter models to provide a solution to cost-effectiveA SD diagnosis, especially in developing countries.","['Clinical decision support for translational/data science interventions', 'Biomarker discovery and development', 'Machine learning and predictive modeling']"
2,Developing Prompts from Large Language Model for Extracting Clinical Information from Pathology and Ultrasound Reports in Breast Cancer,Harnessing the Power of Large Language Models in Health Data Science,"Objectives: We aimed to assess the efficiency, accuracy, and cost-effectiveness of utilizing a large language model (LLM) to extract clinical factors from surgical pathology and ultrasound reports of breast cancer patients.Methods: Data from breast cancer patients (2020-2022) undergoing radiotherapy were collected. The 'LLM' method, employing GPT for SheetsTM and DocsTM, was used to extract information. Prompt development time and cost were compared against 'Full manual' and 'LLM-assisted manual' methods. Accuracy was evaluated by comparing LLM-extracted data with 'Full manual' data for 60 randomly selected patients.Results: Data from 2,931 patients were collected. We created 12 prompts each for Extract and Format functions, achieving 88.3% overall accuracy. Notably, surgery type and lymphovascular invasion had 100% accuracy. Prompt development took 3.5 hours, processing 15 minutes. Using ChatGPT API incurred a $65.8 cost; including wage estimates totaled $91.7. 'LLM-assisted manual' and 'LLM' methods were efficient and cost-effective compared to 'Full manual'.Conclusion: Efficient prompt development for LLM facilitated the extraction of vital clinical information from extensive medical records, showcasing the potential of natural language processing with LLM models in breast cancer research. Our prompts can benefit other studies collecting clinical data. This study underscores the value of LLMs in enhancing clinical information extraction processes.","['Natural Language Processing', 'EHR-based phenotyping', 'Clinical and research data collection, curation, preservation, or sharing']"
3,Association Rule Mining of Real-World Data: Uncovering Risk Patterns for Suicide Attempts in Individuals with Diabetes,Real-World Evidence in Informatics: Bridging the Gap between Research and Practice,"We included 3,266,856 people with diabetes from Cerner Real-World Data™ to identify a high-risk group of suicide attempts among patients with diabetes utilizing association rule mining. The study confirms the links between type 2 diabetes, anxiety, depression, and suicide attempts in individuals with diabetes. New findings associated with suicide attempts from our study included race identified as White, average blood glucose 100 mg/dl.","['Data mining and knowledge discovery', 'Data-driven research and discovery', 'Secondary use of EHR data']"
4,Cybersecurity in Disaster Telehealth: The National Emergency Tele-Critical Care Network (NETCCN) Experience,"Telehealth, Wearable Devices, and Patient-Generated Health Data: The New Frontiers of Informatics","In recent decades, digital telehealth technologies have been deployed at an increasing rate. An important but under-reported aspect of this transformation has been an increase in the vulnerability of health care infrastructure to cybersecurity threats. This is true in everyday patient care, but also in disasters and mass casualties, where telehealth technologies may be rapidly deployed and scaled to address surge capacity and improve access to emergency or specialty care. Here we report on the cybersecurity threats encountered during early deployments of the National Emergency Tele-Critical Care Network, a web-enabled health information and communications platform designed to bring high-quality critical care expertise to any location in the United States.","['Data security and privacy', 'Mobile Health, wearable devices and patient-generated health data']"
5,GRU-D-Weibull: A Novel Real-Time Individualized Endpoint Prediction,Integrating Multi-Modal health Data to Enhance the Power of Informatics,"Accurate prediction models for individual-level endpoints and time-to-endpoints are crucial in clinical practice. In this study, we propose a novel approach, GRU-D-Weibull, which combines gated recurrent units with decay (GRU-D) to model the Weibull distribution. Our method enables real-time individualized endpoint prediction and population-level risk management. Using a cohort of 6,879 patients with stage 4 chronic kidney disease (CKD4), we evaluated the performance of GRU-D-Weibull in endpoint prediction. The C-index of GRU-D-Weibull was ~0.7 at the index date and increased to ~0.77 after 4.3 years of follow-up, similar to random survival forest. Our approach achieved an absolute L1-loss of ~1.1 years (SD=0.95) at the CKD4 index date and a minimum of ~0.45 years (SD=0.3) at 4 years of follow-up, outperforming competing methods significantly. GRU-D-Weibull consistently constrained the predicted survival probability at the time of an event within a smaller and more fixed range compared to other models throughout the follow-up period. We observed significant correlations between the error in point estimates and missing proportions of input features at the index date (correlations from ~0.1 to ~0.3), which diminished within 1 year as more data became available. By post-training recalibration, we aligned the predicted and observed survival probabilities across multiple prediction horizons at different time points during follow-up. The findings underscore the promise of the GRU-D-Weibull architecture as a suitable candidate for real-time individualized CKD4 endpoint risk management, calling for additional refinements and clinical confirmation.","['Data-driven research and discovery', 'Clinical decision support for translational/data science interventions', 'Secondary use of EHR data']"
6,Real World Evidence of Cardiotoxicity: Breast Cancer Oncology Regimens,Real-World Evidence in Informatics: Bridging the Gap between Research and Practice,"This study investigates the cardiotoxicity effects of eight common chemotherapy drugs used in breast cancer treatment based on 6,299 de-identified patient records. The findings reveal elevated low-density lipoprotein cholesterol levels and marginal ejection fraction, among other conditions. These results underscore the need for clinicians to consider cardiovascular risks when planning cancer treatment. The study contributes real-world evidence to the cardio-oncology field, emphasizing the necessity for ongoing monitoring and further research to mitigate these complications.","['Informatics research/biomedical informatics research methods', 'Patient centered research and care', 'Informatics for cancer immunotherapy']"
7,"15,242 Ways to Die: Developing and testing a method to extract an inferred concept with Canary",,"Medical Examiner databases have a large proportion of unstructured text fields for capturing data for investigation of death, not research. As such, research documentation tends to be inferred from the notes rather than simply extracted electronically. This study seeks to determine the location and condition of the body at time of death, called cadaver condition, from scene and decedent notes in a medical examiner database. Natural Language Processing (NLP) was performed using Canary NLP software. After NLP, a set of rules were determined and applied to establish cadaver condition, as different combinations of text could be extracted. An F1 score of 0.86 on the testing sample indicates that the model works well to determine this inferred data. Although this field is difficult to electronically extract due a to lack of structured fields, NLP provides an option for ascertaining the cadaver condition of the decedent.",['Natural Language Processing']
8,Prediction and uncertainty quantification of medical diagnosis through neural machine translation of clinical procedure codes,,A Clinical Decision Support System (CDSS) is an interactive recommendation system that facilitates clinical decision-making. These systems suffer from challenges rooted in the high complexities of medical knowledge and low accessibility of patient data. We developed a framework capable of accurate prediction and uncertainty quantification (UQ) of medical diagnoses which is able to track and assess patients’ conditions via effective UQ through the utilization of neural machine translation of clinical procedure codes and Shannon’s entropy.,"['Clinical decision support for translational/data science interventions', 'Machine learning and predictive modeling']"
9,Retrospective evaluation of QTc Drug-Drug interaction (DDI) Clinical Decision Support (CDS) alerts and Tisdale risk score calculator utilization in the inpatient setting at Brigham and Women’s Hospital (BWH),Real-World Evidence in Informatics: Bridging the Gap between Research and Practice,Clinical Decision Support (CDS) Drug-Drug Interaction (DDI) alerts in the electronic health record usually exclude patient-specific factors. The Tisdale risk score calculator uses clinical variables to predict which hospitalized patients are at high risk for QTc prolongation. The goal of the study was to determine the rate of QTc DDI overrides and Tisdale risk scores. A secondary outcome was to determine the rate of Adverse Drug Events associated with overrides.,"['Clinical decision support for translational/data science interventions', 'Measuring outcomes', 'Enterprise data warehouse/Data lake']"
10,Development of a Decision-Making Support System for Children with Pneumonia in Pediatric Intensive Care Units,"Telehealth, Wearable Devices, and Patient-Generated Health Data: The New Frontiers of Informatics","This study leverages clinical data from the National Taiwan University Hospital Pediatric Intensive Care Unit (PICU) database to develop machine learning models for predicting mortality risk in pediatric patients with pneumonia. These models offer versatility, as they can be employed upon the ICU admission or during the ICU stay, even in cases where laboratory data is not readily available. The primary aim is to mitigate the burden on healthcare professionals and support clinical decision-making.","['Clinical decision support for translational/data science interventions', 'Measuring outcomes', 'Machine learning and predictive modeling']"
11,Classification of Ejection Fraction Values Using Large Language Models,Harnessing the Power of Large Language Models in Health Data Science,"Clinical Natural Language Processing has benefited from pre-trained Large Language Models (LLMs). This study applies LLMs to classify left ventricular ejection fraction (LVEF) values. Our models use a collection of phrases containing LVEF and quantitative values to assign each echocardiogram report one of three categories: ‘40% or below, ‘41 to 49%’, or ‘50% or above’. We hypothesize that LLMs with quantitative reasoning ability can improve classification of LVEF values at the document level. We created transformer-based models using various LLMs. We used the BlueBERT, GPT2 to fine-tune the target task. We also employed more recent LLMs such as DeBERTa and Flan-T5 which have better mechanisms to handle long sentences and represent each word more effectively. All LLM models outperformed the traditional machine learning model, which showed the efficiency of LLMs in handling quantitative values. DeBERTa and Flan-T5 were the best performing models despite not being pre-trained on medical texts. Our study showed that leveraging LLMs can improve text classification with numeric expressions.","['Natural Language Processing', 'Machine learning and predictive modeling']"
12,A Survey of Clinical Algorithms with Race,,"There is growing awareness that clinical algorithms that incorporate an individual’s race as an input variable may cause health care disparities, especially in racial minorities. To raise awareness of race in clinical decision making and track progress toward eliminating its inappropriate use, we identified 46 race-based clinical algorithms and characterized them on specialty, country of origin, model type, output type, and target user. We also built an online database of the identified algorithms.","['Social determinants of health', 'Patient centered research and care', 'Ethical, legal, and social issues']"
13,Develop a PCC surveillance database for tracking post-COVID-19 conditions by Microsoft Access,,"This project is an integral component of the CDC's PCC surveillance initiative. By employing Microsoft Access as our Database Management System, established a secure and HIPAA-compliant database for storing, analyzing, and tracking post-COVID-19 condition data. The objective of this project is to assess the suitability of Microsoft Access for creating user-friendly surveillance databases and to explore its potential utility in diverse COVID-19 research endeavors and beyond.","['Clinical and research data collection, curation, preservation, or sharing', 'Data/system integration, standardization and interoperability']"
14,Comparing Prevalence of Adverse Drug Events Identified in Structured EHR Data to Clinical Trial Benchmark,Real-World Evidence in Informatics: Bridging the Gap between Research and Practice,After-market surveillance of adverse drug events (ADEs) is a critical component of real-world data. Documentation of ADEs is often found in unstructured notes that can require complex methods and workflows to parse. This study explores methods for using structured electronic health record data to identify ADEs in patients receiving systemic anti-cancer therapy. The prevalence of ADEs using these methods is approximately one third of those reported in a clinical trial studying a similar patient population.,"['Data-driven research and discovery', 'Secondary use of EHR data', 'Drug discovery, repurposing, and side-effect discovery']"
15,Improving Discharge and Contingency Planning Using AI-Generated Feedback,,"This study explored the use of AI-generated feedback to improve discharge and contingency planning. Physicians created prompts for the GPT-4 AI system, allowing it to analyze medical notes and provide narrative feedback, including example discharge or contingency planning recommendations. Outputs were assessed using a 5-point Likert scale for understandability, bias, clinical relevance, and clinical usefulness. In total, 67 suggestions met the criteria for distribution, while 15 did not due to lack of clinical “usefulness”.","['Patient centered research and care', 'EHR-based phenotyping', 'Machine learning and predictive modeling']"
16,Characterizing Disclosures of Sexual Trauma in the Electronic Health Record Using Care Site Data and Natural Language Processing,,"This study explores the clinical contexts and a natural language processing model for the detection of references to sexual abuse (SA) in 3 million clinical notes from Vanderbilt University Medical Center. Psychiatric and obstetric specialties are over-represented in these references than would be expected by chance. The model has a precision of 0.97, a recall of 0.99, and an F1 score of 0.98. Researchers can use this methodology to advise decisions about SA screening protocols.","['Natural Language Processing', 'Secondary use of EHR data', 'Informatics research/biomedical informatics research methods']"
17,Identification of Ventilator-Associated Pneumonia: A Comparison of ICD Codes and Physician Review,,"Ventilator-associated pneumonia (VAP) is a frequent and serious complication in intensive care units with high mortality. Accurate identification of VAP has clinical, health system, and research implications. International Classification of Diseases (ICD) codes for VAP are routinely used for administrative and research purposes, the reliability has been questioned. Thus, this study compared the accuracy of ICD codes against physician review for the diagnosis of VAP.","['Data quality', 'EHR-based phenotyping', 'Clinical and research data collection, curation, preservation, or sharing']"
18,Addressing NC Children’s Mental Health Disparity with a Virtual Community House,Fairness and Disparity in Health and Biomedical Informatics: Addressing Inequities through Innovation,"Recognizing the critical role of mental health in overall well-being, our project targets the concerning prevalence of child mental health issues in the United States, especially in North Carolina. We created a 3D virtual mental health community house on Roblox to educate, empower, and support children, with the potential to advance mental health education and research, benefiting both the mental health and informatics fields.","['Patient centered research and care', 'Education and Training', 'Stakeholder (i.e., patients or community) engagement']"
19,"Identifying Psychosis Episodes in Admission Notes: A Comparative Study of Rule-based Methods, Machine Learning Algorithms, and Pre-Trained Language Models",Harnessing the Power of Large Language Models in Health Data Science,"This study examined the efficacy of various methods for identifying psychosis in 4,732 psychiatric admission notes. We compared rule-based algorithms, machine learning classifiers like XGBoost, and pre-trained language models (PLMs). Results showed that XGBoost outperformed other methods, achieving an F1 score of 0.8881, while rule-based and PLMs lagged behind. The study emphasizes the potential of machine learning, especially XGBoost, in improving diagnostic accuracy in psychiatric care, and suggests further research on feature selection and error analysis.","['EHR-based phenotyping', 'Natural Language Processing', 'Machine learning and predictive modeling']"
20,Slow worsening toward acute cardiovascular diseases in patients with lifestyle-related diseases: Longitudinal study using a large clinical database at Kochi Medical School Hospital,Real-World Evidence in Informatics: Bridging the Gap between Research and Practice,"BACKGROUND: Elderly patients having one or more of three major lifestyle-related diseases (LRDs), including diabetes mellitus, hypertension, and hyperlipidemia, are more likely to develop acute cardiovascular diseases (A-CVDs), such as acute cerebrovascular disease (A-CBVD) and acute ischemic heart disease (A-IHD). We investigated how status of LRD patients would slowly worsen toward the onset of A-CVDs several or more years in the future. METHODS: Coded data accumulated in a clinical database having about 340,000 patients at Kochi Medical School Hospital were used. Patients who were 51 years old or older, did not receive any cancer therapies, had one or more LRDs, and developed A-CVDs between five and ten years after LRD diagnosis were selected. Whether these patients developed increased LRDs or other diseases increasing the risk for A-CVDs, such as chronic kidney disease, chronic liver disease, and angina, was investigated. RESULTS: There were 55 cases of A-IHD and 377 of A-CBVD that appeared between five and ten years after LRD diagnosis. The percentages of cases having two or more LRDs or one or more risk diseases were 35% and 24% in A-IHD cases and A-CBVD cases, respectively, at the time of LRD diagnosis, and they increased greatly to 93% and 75% in A-IHD cases and A-CBVD cases, respectively, at the onset of A-IHD and A-CBVD. CONCLUSION: It was found that, in many patients developing A-CVDs between five and ten years after LRD diagnosis, their status clearly worsened slowly toward the onset of A-CVDs.","['Data-driven research and discovery', 'Outcomes research, clinical epidemiology, population health']"
21,Design and Validation of Machine Learning Models Utilizing Pre- and Intra-operative EHR Data to Predict Postoperative Delirium,Proactive Machine Learning in Biomedical Applications: The Power of Generative AI and Reinforcement Learning,"This study aims to design and validate machine learning models to predict postoperative delirium (POD) using preoperative and intraoperative features from patient EHR data, and to compare outcomes across cardiac and non-cardiac surgery cohorts. Utilizing both preoperative and intraoperative risk factors between these distinct patient groups is critical for a comprehensive understanding of patients’ risk of developing POD. This can guide tailoring of patient care to enhance patient prognosis and surgical decision-making across surgical subgroups.","['EHR-based phenotyping', 'Data mining and knowledge discovery', 'Machine learning and predictive modeling']"
22,THRESHOLD: A Comprehensive Transcriptomic Analysis Tool for Evaluating Gene Saturation and Impact in Disease Progression,Implementation Science and Deployment in Informatics: From Theory to Practice,"Gene expression analysis is fundamental in molecular biology for deciphering cellular function and understanding diseases. To tackle the complexities of large datasets, the THRESHOLD software was developed, employing Python and Java with essential libraries. It utilizes saturation analysis to identify highly expressed genes shared among diverse patient datasets, offering a novel approach to uncovering common gene expression patterns. THRESHOLD features 'Incremental Saturation' for in-depth analysis at specific ranks and 'Overall Saturation' for a comprehensive overview. Users can customize saturation types, restriction factors, and rank types, generating interactive saturation graphs and identifying saturated genes.THRESHOLD's significance lies in its ability to consistently identify regulated genes in diseases, with user-defined parameters, providing insights into potential drug targets, disease pathways, and gene networks. THRESHOLD has the potential to advance our understanding of molecular signatures, refine patient stratification, and facilitate tailored therapeutic interventions, making it a valuable resource in molecular biology research. THRESHOLD is freely available at https://github.com/alperuzun/THRESHOLD","['Transcriptomics', 'Data-driven research and discovery', 'Genomics/Omic data interpretation']"
23,"Data Governance for Sharing and Access to Real-World Data at University of Iowa Healthcare, a Case Study",,"Data governance enables secondary use of clinical data for research, including policies and procedures for managing data to ensure accuracy, completeness, consistency, and security. Establishing standards for collection, storage, sharing, and assigning roles and responsibilities for managing data is critical throughout a project’s lifecycle. This describes the evolution of UI HealthCare’s data governance for research, development of an external data sharing process, implementation of related processes, continuous improvement and ongoing observations of data governance maturity.","['Data sharing / interoperability', 'Enterprise data warehouse/Data lake', 'Sustainable research data infrastructure']"
24,Evaluating ChatGPT as an Adjunct for Clinical Data Extraction,Harnessing the Power of Large Language Models in Health Data Science,"This case report investigates the application of the GPT-4 language model in extracting clinically relevant information from medical reports across a variety of conditions. Key findings were identified by GPT-4 from diverse reports including Next-Generation Sequencing, Fluorescent In Situ Hybridization, Flow Cytometry, Chromosome Analysis, Echocardiogram, and Dual X-ray Absorptiometry scans. Preliminary results suggest that the GPT-4 model potentially improved data extraction efficiency by outperforming traditional SQL query practices by a factor of 4 to 9 in our specific setup, while also effectively managing data variations. These findings, although promising, need further validation through larger-scale studies. The initial evidence, however, underscores the potential utility of GPT-4 in enhancing the speed and accuracy of clinical data extraction, which can be beneficial in both research and clinical contexts.","['Data mining and knowledge discovery', 'Natural Language Processing', 'Clinical and research data collection, curation, preservation, or sharing']"
