row_id,submission_TITLE,HIGHLIGHTED THEME (OPTIONAL),submission_ABSTRACT,KEYWORDS_SELECTION
79,Development of an Adaptable Cost-Analysis Tool to Support the Implementation of the CONCERN Early Warning System,,"Cost as a component of feasibility when implementing clinical decision support systems is often overlooked. Our work demonstrates and agile cost analysis of Communicating Narrative Concerns Entered by RNs (CONCERN), an early warning system based on nursing generated data. We developed an Excel-based cost estimation tool which uses cost data based on literature and national averages. This tool can be repurposed and reused with local data to create an easily sharable and executable cost model to determine the feasibility of implementing CONCERN (or other CDS interventions).","['Reproducible research methods and tools', 'Clinical decision support for translational/data science interventions', 'Measuring outcomes']"
80,Informative Sampling to Enhance Clinical Chart Review Representativeness,,"“Gold-standard” labels from clinicians are crucial for developing computational phenotyping algorithms. Typically, charts are sampled randomly. However, random sampling may not be able to capture the diverse manifestations of the patient population. To address this issue, this project introduces an informative sampling approach to select medical charts for review, enhancing clinical chart review efficiency.","['Data mining and knowledge discovery', 'Clinical and research data collection, curation, preservation, or sharing']"
81,Socio-economic Disparities in Infection-related Hospitalizations among the U.S. Home Health Care Population: Insights from a National Study,Fairness and Disparity in Health and Biomedical Informatics: Addressing Inequities through Innovation,"This study aims to understand the association between socioeconomic status (SES) of home health care (HHC) patients and infection risk. SES is quantified by the Area Deprivation Index (ADI) using multiple national datasets. The study sample includes 3,656,734 Medicare beneficiaries receiving HHC during 2019 from 8,133 HHC agencies. We used logistic regression models to investigate the association between ADI and infection risk and found significant associations for female and dual-eligible patients.","['Social determinants of health', 'Public health informatics', 'Patient centered research and care']"
82,Large Language Models and Biomedical Annotators to Extract Information from Scientific Literature in Inflammatory Bowel Disease,Harnessing the Power of Large Language Models in Health Data Science,This poster discusses two automated approaches for identifying important information from scientific literature to assist literature reviews. A Large Language Model (LLM) and biomedical text annotator (UMLS-based MetaMap) were used to identify and ascertain keywords and methods from a collection of Inflammatory Bowel Disease (IBD) abstracts. The results were assessed by human experts for accuracy and relevancy.,"['Natural Language Processing', 'Informatics research/biomedical informatics research methods', 'Clinical and research data collection, curation, preservation, or sharing']"
83,Precision phenotyping of schizophrenia in an EHR-linked biobank,Integrating Multi-Modal health Data to Enhance the Power of Informatics,"Schizophrenia (SCZ) is a highly heritable and relatively rare neuropsychiatric condition whose pathogenic mechanisms are largely unknown. Scalable EHR-based methods are needed to accurately identify individuals with SCZ for large studies across diverse populations and healthcare settings. Using structured clinical data from the Vanderbilt University Medical Center electronic health record (EHR), we constructed 72 phenotype definitions and tested their performance against manual chart review labels. Applying these approaches to our EHR-linked biobank, we found that the definitions with the highest positive predictive values had the highest genomic specificity to SCZ. This study demonstrates the utility of EHR-based approaches in ascertaining individuals with SCZ for future genetic and epidemiological studies.","['EHR-based phenotyping', 'Genotype-phenotype association studies (including GWAS)', 'Informatics research/biomedical informatics research methods']"
84,Ink: Non-repudiation for Large Language Models (LLMs) in Healthcare,Harnessing the Power of Large Language Models in Health Data Science,"We are increasingly likely to see Large Language Models (LLMs) used in a healthcare context. To address potential issues around liability when this occurs, we introduce Ink, an LLM-backed chatbot that can be used to generate securely signed, non-repudiable records of chats that have taken place. These chats can then be validated at a later date if required. As a proof-of-concept, Ink is connected to several predominant LLMs, including GPT-3.5/4.","['Data security and privacy', 'Machine learning and predictive modeling', 'Ethical, legal, and social issues']"
85,ICT for Cost Effective Improvement of Routine Childhood Immunization,,"This research project offers a gradual replacement of the current immunization process in a low-resource setting using a low-cost LETUS (Lightweight Electronic Traceable and Updatable System) solution to increase immunization coverage, and traceability. The eHealth solution will improve the coverage of childhood immunization and reduce the need for supplemental immunization campaigns.","['Public health informatics', 'Secondary use of EHR data', 'Data/system integration, standardization and interoperability']"
86,A Software Ecosystem for FAIR Deep Learning in Digital Pathology,Citizen Science and Democratizing AI and Informatics for Healthcare,"Deep learning has transformed digital pathology, but the number of reusable trained models remains low. We address this need in the present work by developing a repository of open and reusable pre-trained models for slide-level inference across cancers, as well as software tools to efficiently deploy these models on digital pathology images. Our hope is that this new ecosystem will help to democratize deep learning in digital pathology.","['Reproducible research methods and tools', 'Bioimaging techniques and applications', 'Machine learning and predictive modeling']"
87,The Impact of Spiritual Care on Comfort in Older Adults with Chronic Illnesses: An Event Study Design,Real-World Evidence in Informatics: Bridging the Gap between Research and Practice,"Using interoperable nursing care plan data from electronic health records, our findings suggest that spiritual care improves physical comfort in older adults chronically ill after the second nursing shift. Nurses may integrate spiritual care more frequently into their usual care to better assist patients experiencing distress. Further research is needed to better comprehend the association between spiritual care and other well-being measures.","['Secondary use of EHR data', 'Patient centered research and care', 'Data/system integration, standardization and interoperability']"
88,External Validation of a Machine Learning Model to Predict Postpartum Hemorrhage in a Large Dataset from Northeast US,Real-World Evidence in Informatics: Bridging the Gap between Research and Practice,"Postpartum hemorrhage is the leading cause of severe maternal morbidity and mortality. As the current predictive tools are lacking and a new machine learning model has been developed, we validate its performance in a retrospective cohort of all deliveries between 2015-2022 in our healthcare system. The model had an area under the curve (AUC) of 0.77. These results demonstrate the potential of machine learning models to add value to care at the time of delivery.","['EHR-based phenotyping', 'Machine learning and predictive modeling', 'Ethical, legal, and social issues']"
89,Predicting Organ Rejections for Pediatric Heart Transplantations with a Combined Use of Transplant Registry Data and Electronic Health Records,Real-World Evidence in Informatics: Bridging the Gap between Research and Practice,"Donor organs are a limited resource with significant waitlist time and waitlist mortalities. Even though overall 5-year survival rate for pediatric heart transplant recipient continues to improve, ongoing concerns on the rates of late acute rejection (LAR) and hospitalization within this population remain. Prior research has provided initial evidence that machine learning algorithms can be used to predict posttransplant outcomes in pediatric organ transplantation, but these prediction models offer unsatisfactory predictive accuracy, possibly due to the use of only organ registry data but not fine-grained clinical data. In this study, we linked a transplant center patients’ electronic health records (EHRs) with the United Network for Organ Sharing (UNOS) registry data, allowing for the use of ML to identify at-risk patients with high accuracy and risk factors for poor posttransplant outcomes.","['Data mining and knowledge discovery', 'Secondary use of EHR data', 'Machine learning and predictive modeling']"
90,Enhancing Suicide Risk Detection in EHRs: Leveraging Large Language Models to Identify Explicit and Implicit Suicidal Indications,,"This study utilizes Large Language Models (LLMs) to improve the identification of both explicit and implicit suicidal mentions within Electronic Health Records (EHRs). Using the MIMIC database, 4,360 clinical notes were annotated, from which 2,134 were identified as relevant for suicidal behaviors. Deep Learning models, especially Clinical BERT, outperformed traditional methods, achieving up to 87% precision and 85% recall. The research highlights LLMs' potential in enhancing suicide risk detection.","['Natural Language Processing', 'Public health informatics', 'Machine learning and predictive modeling']"
91,Evaluating Temporal Characterization of EHR in BERT-based Model Architectures to Predict Multi-morbidity in Diabetes Patients,Harnessing the Power of Large Language Models in Health Data Science,"The Transformers architecture, notably BERT, revolutionized contextual learning and has been applied effectively to Electronic Health Records (EHR) due to similarities with natural language sequences. BERT efficiently constructs comprehensive EHR representations, capturing intricate medical history details. This study focuses on predicting major complications in diabetes patients, comparing prediction performance across diverse BERT architectures with various temporal representations. It also assesses the value of incorporating temporal data compared to context-time-unaware models like XG-Boost classifiers for risk prediction.","['Data-driven research and discovery', 'Data mining and knowledge discovery', 'Machine learning and predictive modeling']"
92,A Human-Centric Approach for Self-Service Analytics of Longitudinal Health Data,,"Efficient analytical access to longitudinal data for clinician scientists is crucial for translational medicine. However, typical analysis tasks require cross-sectional tabular data representations, so transformations need to be applied to longitudinal facts. However, established self-service data warehouse platforms offer limited aggregation functionalities for longitudinal data and specialized query languages are rather complex with a steep learning curve. We introduce a human-centric approach to longitudinal data transformation for self-service analytics, based on a domain-specific language, paired with a graphical editor and analytical tools. Our versatile framework integrates seamlessly with common data warehouse platforms. At Charité, the approach is used to provide oncologists with analytical access to clinical cancer registry data based on Informatics for Integrating Biology and the Bedside (i2b2).","['Data-driven research and discovery', 'Secondary use of EHR data', 'Advanced data visualization tools and techniques']"
93,Incorporating Natural Language Processing (NLP) into the EMERSE Information Retrieval System,Implementation Science and Deployment in Informatics: From Theory to Practice,"EMERSE, a search engine for clinical documents, has been enhanced to include an 'aligned-layer retrieval model' that allows for powerful search capabilities including negation and uncertainty status, semantic type labeling, case-sensitivity, and more. This was achieved by layering attributes over the indexed terms. Despite the index size increasing by 26%, it has not noticeably affected search time. These additions make the tool more efficient and comprehensive for non-technical clinical researchers.","['Informatics research/biomedical informatics research methods', 'Natural Language Processing', 'Data Integration']"
94,Beyond off-the-shelf Machine Learning: case for clinician-in-the-loop,Implementation Science and Deployment in Informatics: From Theory to Practice,Unlocking the potential of machine learning in healthcare demands a tailored approach that cannot be replaced by the recent advancements of “one-size-fit-all” large deep learning models and off-the-shelf solutions. In this paper we emphasize the need for more nuanced clinician-in-the-loop methodologies where clinical input should be considered in the development of every predictive model from the design stage using appropriate algorithms that allow this input beyond the mere formulation of the clinical question.,"['Learning healthcare system', 'Collaborative workflow systems', 'Machine learning and predictive modeling']"
95,Variability of Correlation Structures of Synthetic Data in Machine Learning Algorithms,Integrating Multi-Modal health Data to Enhance the Power of Informatics,"Synthetic data is computationally-derived data that is designed by algorithms to similarly represent real world data. It is often employed in the use of big data for machine learning algorithms, which are an increasingly common occurrence in the field of medicine. Synthetic data promises to provide more accessible, less expensive, and safer alternative that preserves the biological and medical meaning of the data to the use of real world data in healthcare. It has broad use in many new and advancing technologies that target predictive analytics and discovery analytics, among others. This research aims to determine how well machine learning (ML) models are able to maintain the integrity of variable correlation relationships between both synthetic and real data. It also aims to ascertain the presence or absence of biases within the artifact subspace structure of synthetic data when comparing queries by evaluating the efficacy of ML models trained on multiple MDClone-generated synthetic queries using Epic clinical breast cancer data to predict mortality. The findings indicate that tree-based models are most effective at maintaining feature relationships between real world and synthetically generated data. Additionally, a notable reduction in model performance when the model is trained on combined synthetic data, possibly due to the disturbance in the artifact subspace structure.","['Data sharing / interoperability', 'Health Information and biomedical data dissemination strategies', 'Machine learning and predictive modeling']"
96,Harnessing consumer wearable digital biomarkers for individualized recognition of postpartum depression within the All of Us Research Program,"Telehealth, Wearable Devices, and Patient-Generated Health Data: The New Frontiers of Informatics","Postpartum depression (PPD) affects one in seven women, with detection challenges due to limited in-person visits and subjective screening methods. In women with PPD, intra-individual machine learning (ML) models using wearable-derived digital biomarkers were developed to distinguish between different phases of pregnancy (pre-pregnancy, pregnancy, postpartum without depression, and postpartum with depression (PPD)). Furthermore, individualized models outperform conventional ML approaches, highlighting personalized ML for early disease detection.","['Patient centered research and care', 'Mobile Health, wearable devices and patient-generated health data', 'Machine learning and predictive modeling']"
97,EchoGPT: Extracting Echocardiogram Entities using Large Language Models,Harnessing the Power of Large Language Models in Health Data Science,"Large Language Models (LLMs) can potentially standardize unstructured electronic health data with increased superiority to traditional natural language models. To assess their entity extraction capabilities, we compared the performance of zero-shot and few-shot learning of GPT-4 to extract and classify data from echocardiogram reports against gold standard clinician annotations. We found that a relaxed matching approach combined with either learning modality provided the best performance while ensuring data is transformed into a more standardized structure.","['Natural Language Processing', 'Secondary use of EHR data', 'Data/system integration, standardization and interoperability']"
98,Quantifying Pre-Hospital Delays Using Natural Language Processing,Harnessing the Power of Large Language Models in Health Data Science,"Longer prehospital delays can worsen outcomes, but wide-scale research is limited by lack of data. This study uses free-text clinical notes to extract information about the time elapsed between symptom onset and hospital arrival. I evaluate two approaches for end-to-end relation extraction of symptom-timing pairs: supervised machine learning with rule-based extraction and few-shot learning using large language models. Preliminary results suggest these methods hold promise for shedding light on delays in patient access to care.","['Natural Language Processing', 'Secondary use of EHR data']"
99,Network Graph Solutions for Data Pipeline Diagnostics,,"A key challenge for studies using electronic health records is the development of a data pipeline that maps the raw EHR data to an analytic dataset. Here we propose the use of directed bipartite graph models to visualize, interrogate, and refine the data engineering process. By promoting both transparency and data integrity, this diagnostic approach may help to improve the reproducibility and quality of studies that rely on EHR data.","['Reproducible research methods and tools', 'Advanced data visualization tools and techniques', 'Knowledge representation, management, or engineering']"
100,Pediatric Site Response to the Rapid Implementation of Decentralized Clinical Trials,"Telehealth, Wearable Devices, and Patient-Generated Health Data: The New Frontiers of Informatics","The COVID-19 pandemic led to rapid implementation of telehealth services to conduct clinical research. Increased use of decentralized clinical trials (DCTs) has resulted in gaps in evidence-based outcomes and lack of standardization across research entities, making research sites hesitant to adopt DCT practices from sponsors and CROs. This research aims to identify and compare perceived barriers and facilitators for pediatric research sites conducting DCTs to other research sites for clinical research professionals.","['Clinical trials innovations', 'Patient centered research and care', 'Data/system integration, standardization and interoperability']"
101,Developing and Simulating a Clinical Machine Learning Model to Predict Acute Kidney Injury (AKI) in NICU Patients,,"Acute Kidney Injury (AKI) is an abrupt reduction in kidney function that is associated with higher mortality in the Neonatal Intensive Care Unit (NICU) and can lead to chronic kidney disease in infancy and early childhood. A timely diagnostic and management response to infants in the NICU who are at risk of AKI is critical. Our goal is to develop and implement an actionable machine learning model that continuously monitors patients and alerts providers if a patient is at high risk of developing AKI within the next 7 days.We collected a retrospective dataset of all patients in our own NICU spanning from 2017-2021, resulting in 5,395 patient encounters. We identified 486 episodes of AKI affecting 7% of patients. As machine learning features, we curated a set of 41 clinically interpretable variables based on prior literature and expert opinion. We chose a LASSO regularized logistic regression model to achieve full model explainability and reduce our features to a small set of clinically actionable risk factors. We trained and validated the model using 10-fold cross validation.Our final model consists of 12 risk factors and achieves a cross-validated ROC AUC of 0.74. Simulating the model in real-time, this corresponds to correctly predicting 60% of AKI episodes up to 7 days in advance when alerting on an average of 15% of NICU patients per day. We are currently working with our Epic informatics team to implement the model as part of our EHR.","['Clinical decision support for translational/data science interventions', 'Machine learning and predictive modeling', 'Implementation Science']"
102,Derivation and validation of a rule-based small cell masking tool for privacy protection in aggregated tabular reports,,"In biomedical research, protecting patient privacy is crucial for data sharing, whether patient-level or aggregated. Low patient counts in aggregated reports increases disclosure risk and compromises privacy. Therefore, masking low-patient counts is required. For complex reports with several thousand cells, manual masking is time-consuming, and human error-prone, warranting an automated solution. We have developed and validated an automated cell-masking tool in R which applies to one- two- and three-way frequency tables with high accuracy.","['Data security and privacy', 'Sustainable research data infrastructure', 'Clinical and research data collection, curation, preservation, or sharing']"
103,MyChart Messaging: Patient Expectations for Providers,Real-World Evidence in Informatics: Bridging the Gap between Research and Practice,"MyChart messaging allows for convenient patient-provider communication. Portal messaging has grown recently, leading to increased physician workload. A patient-facing survey was administered to better understand patient expectations for provider message responses. Results show that patients prefer prompt responses from providers and providers are meeting these expectations, despite the large message volume they face. Patients also prefer unrestricted hours of messaging. Solutions to reduce burden must be created that do not limit patients' access to messaging.","['Health literacy issues and solutions', 'Clinical and research data collection, curation, preservation, or sharing', 'Stakeholder (i.e., patients or community) engagement']"
104,Using Large Language Models to Assess Scientific Portfolio of Research Projects in the All of Us Research Program,Harnessing the Power of Large Language Models in Health Data Science,"The All of Us Research Program is building the largest, most diverse research biorepositories. The program created Scientific Priorities Roadmap to characterize scientific inquiries researchers are investigating. We used large language model (LLM) to classify All of Us projects focusing on genetics, health equity, maternal/child health, healthy aging, and lifestyle/substance/behavioral. We compared LLM to 116 annotated projects. Health equity had highest F1 (0.67). Our analysis showed the possibility of using LLM to classify scientific projects.","['Natural Language Processing', 'Data mining and knowledge discovery', 'Implementation Science']"
105,Evolution of Phenotype Algorithms: A Case Study with Type 2 Diabetes,,"Phenotype algorithms are disseminated to the scientific community for adaptation and reuse, but little is known about how a phenotype algorithm is adopted and adapted for a new setting. Using type 2 diabetes mellitus as a case study, we reviewed a single phenotype algorithm’s 183 citations in PubMed, identifying 67 studies that implemented the algorithm in some form, with 21 of those making modifications. Common adaptations included adding ICD-10 codes and removing or relaxing criteria.","['EHR-based phenotyping', 'Secondary use of EHR data', 'Knowledge representation, management, or engineering']"
106,Enhancing COACH for Effective Hypertension Management: Executing Implementation and Deployment Strategies,Implementation Science and Deployment in Informatics: From Theory to Practice,"This study addresses the significant public health challenge of hypertension, which elevates the risk of cardiovascular disease. We introduce COACH, a web-based tool for hypertension care planning and patient self-management, and seek feedback on user interface design, alerts, notifications, and emergency instructions. Focus groups and clinic visits informed programming recommendations, prioritized using the MoSCoW method. Key COACH features, informed by the focus groups, include dual BP alerts and clear patient instructions.","['Patient centered research and care', 'Public health informatics', 'Implementation Science']"
107,Visualizing Computable Phenotypes,,"The Centralized Interactive Phenomics Resource (CIPHER) hosts novel visualization tools and thousands of phenotype definitions: https://phenomics.va.ornl.gov/web/. The tools are directly linked to the phenotypes within the knowledgebase. With a single click, users can explore phenotype details by navigating to the phenotype definition from the visualization. Users can also immediately navigate to the tool from the phenotype details. These visualizations promote interoperability and enhance the user experience by providing resources to examine, develop, and refine phenotypes.","['EHR-based phenotyping', 'Advanced data visualization tools and techniques', 'Data/system integration, standardization and interoperability']"
