row_id,submission_TITLE,HIGHLIGHTED THEME (OPTIONAL),submission_ABSTRACT,KEYWORDS_SELECTION
108,An efficient Python PheWAS tool for analysis on large-scale biobank data,,"With the rapid growth of genetic and healthcare data as well as computing infrastructure, association studies, such as the phenome-wide association study (PheWAS), have become powerful discovery tools in biomedical research. PheWAS is an analysis method to study gene-phenotype associations utilizing genetic and longitudinal electronic medical record data.[1] Previous packages have been developed for PheWAS analysis, however, the Python PheWAS package described here was written to fulfill the need for a tool that is easy to use while capable of handling biobank scale data efficiently.[2 3] References1. Denny JC, Ritchie MD, Basford MA, et al. PheWAS: demonstrating the feasibility of a phenome-wide scan to discover gene-disease associations. Bioinformatics 2010;26(9):1205-10 doi: 10.1093/bioinformatics/btq126[published Online First: Epub Date]|.2. Carroll RJ, Bastarache L, Denny JC. R PheWAS: data analysis and plotting tools for phenome-wide association studies in the R environment. Bioinformatics 2014;30(16):2375-6 doi: 10.1093/bioinformatics/btu197[published Online First: Epub Date]|.3. Kerley CI, Chaganti S, Nguyen TQ, et al. pyPheWAS: A Phenome-Disease Association Tool for Electronic Medical Record Analysis. Neuroinformatics 2022;20(2):483-505 doi: 10.1007/s12021-021-09553-4[published Online First: Epub Date]|.","['Data-driven research and discovery', 'Phenomics and phenome-wide association studies', 'Reproducible research methods and tools']"
109,Machine Learning Approaches to Investigate Association Between Overall Survival and Comorbidity and Concurrent Medications Use in Senior Prostate Cancer Patients,,"In the US, most cancers occur in senior patients having on average 3 comorbidities and taking 6 medications. The amount of confounding data needed to account for both disease-cancer and drug-cancer interactions overwhelms typical randomized clinical trials. This study leverages large-scale retrospective medical records at Moffitt for machine learning modeling of overall survival and feature analysis.","['Data-driven research and discovery', 'Informatics research/biomedical informatics research methods', 'Machine learning and predictive modeling']"
110,Is Your Mapping of Medications to a Standard Terminology Correct?,Implementation Science and Deployment in Informatics: From Theory to Practice,"Achieving semantic harmonization of medication data is critical for data interoperability. However, once a mapping from a local to a standard terminology is generated, a pressing question arises: How can we reliably assess the accuracy of this mapping? To address this challenge, we analyzed the behavior of selected attributes of medication concepts being mapped, augmenting the customary lexical comparisons.","['Data sharing / interoperability', 'Data quality', 'Secondary use of EHR data']"
111,Predicting Hospital Readmission for Patients with OSA and Other Comorbidities Using Natural Language Processing,,"Obstructive Sleep Apnea (OSA) is a prevalent sleep disorder associated with serious health conditions. Our project utilized the Blue Bert language model to identify informative tetragrams specific to OSA subphenotypes. Additionally, we trained a Logarithmic regression model for predicting hospital readmission and diagnostic codes among OSA and Atrial Fibrillation patients using unstructured discharge notes. Our results showed 0.82 AUC for OSA phenotype diagnosis, but future work is needed to improve hospital readmission performance.","['EHR-based phenotyping', 'Secondary use of EHR data', 'Machine learning and predictive modeling']"
112,Predictors of 30-Day Hospital Readmission After Atrial Fibrillation Admission: A 2017 Nationwide Readmission Analysis in the United States,,"Atrial fibrillation (AF), the most common cardiac arrhythmia, leads to 15% of AF patients experiencing readmissions within 30 days in the US. This study aimed to uncover all-cause 30-day readmission rate, readmission predictors, and performance of the predictive models using the 2017 Nationwide Readmission Database. A hierarchical mixed linear model was used on the best performing model to identify the predictors of readmission based on index admission. Among 281,035 AF adult patients surviving their initial hospitalization, 43,375 (15.4%) faced readmission within 30 days. Readmitted patients were predominantly older (median age 75 vs. 72) and more frequently female (55.6% vs. 52.2%), compared to those not readmitted. Comorbidities at the AF index event, like metastatic cancer, lymphoma, and severe renal failure predicted higher 30-day readmission rates. This underscores comorbidities' pivotal role in readmission risk, warranting further research for streamlined models to capture AF-related readmission factors within healthcare systems.","['Public health informatics', 'Outcomes research, clinical epidemiology, population health', 'Machine learning and predictive modeling']"
113,Use of Large Language Models to Automate the Risk-Stratified Screening Colonoscopy Interval Determination,Harnessing the Power of Large Language Models in Health Data Science,"We describe the use of LLMs to provide an automated screening colonoscopy interval when evaluated on synthetic data. 100 examples were randomly selected for the synthetic testing set. 3 prompts were created to test the ability to determine the correct screening colonoscopy interval. GPT 3.5 had a superior average performance (55%) compared to PALM (51%) and Dolly (3.5%). Subsequently, the performance of GPT 4 improved to 98%. Further evaluation using actual clinical data is required.","['Clinical decision support for translational/data science interventions', 'Natural Language Processing', 'Clinical and research data collection, curation, preservation, or sharing']"
114,Trans-Balance: Reducing Demographic Disparity for Prediction Models in the Presence of Class Imbalance,Fairness and Disparity in Health and Biomedical Informatics: Addressing Inequities through Innovation,"Risk prediction, including early disease detection, prevention, and intervention, is essential to precision medicine. However, inappropriate use of risk prediction models can worsen health inequities, in that the systematic bias in risk estimation caused by the heterogeneity across different demographic groups can lead to inappropriate or misinformed treatment decisions. In addition, low incidence (class-imbalance) outcomes negatively impact the classification performance of many standard learning algorithms which further exacerbates the racial disparity issues. Therefore, it is crucial to improve the performance of statistical and machine learning models in underrepresented populations in the presence of heavy class imbalance. In this study, we leverage recent advances in imbalance learning, transfer learning, and federated learning to develop a new framework for bias-corrected models that borrow information across different cohorts without sharing individual patient data. We show that the proposed Trans-Balance framework improves upon existing approaches by explicitly accounting for heterogeneity across demographic subgroups and cohorts. We demonstrate the feasibility and validity of our methods through numerical experiments and a real application to a multi-cohort study with data from participants of four large, NIH-funded cohorts for stroke risk prediction.","['Informatics research/biomedical informatics research methods', 'Data Integration', 'Machine learning and predictive modeling']"
115,Optimal Duration for Steroid Therapy in Inflammatory Bowel Disease: A Causal Analysis using the UK Biobank,Real-World Evidence in Informatics: Bridging the Gap between Research and Practice,The submission is a poster.,"['Data-driven research and discovery', 'Machine learning and predictive modeling', 'Outcomes research, clinical epidemiology, population health']"
116,Fostering communication between parents and clinicians using behavioral visualizations of children with autism,Integrating Multi-Modal health Data to Enhance the Power of Informatics,"Autism Spectrum Disorder (ASD) is diagnosed in children with developmental and behavioral difficulties. The Centers for Disease Control and Prevention (CDC) states that 1 in 44 children in the United States have autism. Early diagnosis of autism can help parents and clinicians better plan interventions to help the child. Parents of the child need to understand the social behaviors of their child to help with the appropriate interventions. Communication between parents and clinicians is still an area of research that needs to be further studied. Several screening methods like the RapidABC (Rapid Attention Back and Forth Communication) protocol have made it difficult to generate a behavioral model that can help express micro and macro behaviors of the child at a glance. Tools like EnGaze and Plexlines can help visualize these social behaviors of the child. These visualizations use different colors to encode gaze, vocals, and gestures of the child in the form of bars and circles respectively. These visualizations can serve as a longitudinal record for multiple clinician visits and can be used to compare different types of behaviors. We have augmented the interfaces of these tools using an annotations bar for notes. We conducted interviews to understand parent-clinician communication surrounding these visualizations. We are also exploring the advantages and disadvantages of encoding behaviors using artificial intelligence techniques. Our goal is to foster parent-clinician interactions using behavioral visualizations of children who have autism.","['Data-driven research and discovery', 'Advanced data visualization tools and techniques', 'Stakeholder (i.e., patients or community) engagement']"
117,Institutional Characteristics Associated with Sharing and Accessing Electronic Health Record Data Centralized by the National COVID Cohort Collaborative (N3C) for COVID-19 Research,,"Clinical data sharing for research is crucial for timely real-world analyses. For example, the National COVID Cohort Collaborative (N3C) was established early 2020 to gather electronic health records (EHRs) across institutions for COVID-19 research. N3C is now one of the largest centralized US repositories of de-identified EHRs. Despite enormous success, some institutions do not share data. We tested institutional characteristics for associations with N3C data sharing to identify addressable barriers for future data sharing initiatives.","['Data sharing / interoperability', 'Data-driven research and discovery', 'Clinical and research data collection, curation, preservation, or sharing']"
118,Unsupervised Natural Language Processing to Identify Topics in Cancer Center Patient Portal Messages,Real-World Evidence in Informatics: Bridging the Gap between Research and Practice,"Patient portal messaging has surged, leading to increased workloads. We employed BERTopic, an NLP-based technique using BERT, to identify topic categories and frequencies in patient-generated messages sent to a cancer center from 2011 to 2023. Four hundred topics were detected from 2,280,851 messages, which were later condensed to 62. The most prevalent topics included expressing appreciation, messages about prescription, and scheduling discussions. NLP has efficiently identified real-world topics, suggesting potential applications for automating message routing.","['Natural Language Processing', 'Data-driven research and discovery', 'Data mining and knowledge discovery']"
119,Improving the Financial Sustainability of Telemedicine by Addressing Peritelehealth Administrative Tasks,,"The department of psychiatry has one of the highest proportions of telehealth at Penn Medicine; 73-76% of visits are conducted via telemedicine. The department, and other high telehealth users like it, experience many challenges around peri-telehealth administrative activities, such as collecting pre-visit payments. These problems have many downstream effects, including increased financial burden, and are attributed, in part, to the current telehealth platform which does not integrate with the electronic health record (EHR) system. Health system leadership decided to pilot a new/EHR integrated telehealth platform to address these challenges and wanted to determine whether such changes affected the provider and patient experience.","['Reproducible research methods and tools', 'Secondary use of EHR data', 'Implementation Science']"
120,Exploring the applicability of the pre-hospital electrocardiogram transmission system through the user-centered design,"Telehealth, Wearable Devices, and Patient-Generated Health Data: The New Frontiers of Informatics","Pre-hospital electrocardiography is crucial for medical direction during patient transport and treatment post-arrival. Nonetheless, conducting 12-lead ECG tests in an ambulance and over long distances have both technical and human challenges. for solving the problems, we made a prototype transmission system for pre-hospital electrocardiography. and We simulated the prototype system through real-world users, involving two groups: EMTs/nurses and doctors. after simulation, they assessed usability by interviews and PSSUQ. Results showed relatively satisfactory system usefulness, but information quality is not satisfied. This study holds significance for enhancing system feasibility and gathering feedback from actual users. ultimately, we can suggest more better system than before.","['Collaborative workflow systems', 'Clinical trials innovations', 'Mobile Health, wearable devices and patient-generated health data']"
121,Patient2Trial: A Knowledge Guided Large Language Model-based System for Matching Patients to Clinical Trials,Harnessing the Power of Large Language Models in Health Data Science,"The recruitment of suitable patients for clinical trials is a critical aspect in evaluating new treatments and interventions. This study proposes Patient2Trial, a system that leverages the advanced GPT-4 model and domain knowledge to efficiently match patients to appropriate clinical trials. Patient2Trial is composed of three components: candidate retrieval, eligibility identification, and trial ranking. The first step of candidate retrieval involves filtering disease-specific trials, expanding patient information using GPT-4 and expert curated knowledge guidelines, and retrieving candidates trials from the filtered collection given an expanded patient information. The second step involves using GPT-4 to identify trial eligibility as well as to generate matching scores for each inclusion criterion of a candidate trial identified as eligible. The third step involves ranking the eligible trials based on the matching scores of inclusion criteria. The system was evaluated on 80 patient-trial pairs using synthetic patient templates covering multiple diseases. The results, reviewed by three independent clinicians, showed a promising NDCG@10 score of 0.9661 and an accuracy of 80%. Furthermore, GPT-4's reasoning descriptions were found to be 85% accurate. Patient2Trial effectively addresses the limitation of 'lack of medical domain-specific knowledge' pointed out in prior work.","['Natural Language Processing', 'Clinical trials innovations', 'Informatics research/biomedical informatics research methods']"
122,"Early Alerts, Timely Actions: Evaluating the Impact of the CONCERN Early Warning System on Reducing Sepsis Risk",,"The Communicating Narrative Concerns Entered by RNs (CONCERN) is an early warning system that identifies patients at risk of clinical deterioration by leveraging nursing documentation as a proxy of nurses' shifting surveillance. In this ancillary analysis from our cluster-randomized trial, we investigate CONCERN's influence on sepsis care trajectories, focusing on the time duration between CONCERN score changes and the initiation of sepsis-related clinical interventions. Preliminary findings show CONCERN”s potential to impact sepsis care management.","['Clinical decision support for translational/data science interventions', 'Data-driven research and discovery', 'Implementation Science']"
123,VIOLIN In 2024: 15 Years of Vaccine Resource Development,,"The Vaccine Investigation and Online Information Network (VIOLIN) is a comprehensive and integrative vaccine research database and analysis platform accessible at https://violinet.org. Initial in 2008, VIOLIN now includes over 4,550 vaccines targeting 216 pathogens and eight noninfectious diseases, including cancers and allergies. VIOLIN has since hosted >20 independent programs for vaccine research. While the majority of these VIOLIN programs are databases, many ontology- and bioinformatics-based methods and tools for transcriptome analysis or natural language processing (NLP) analysis have also been developed to dissect vaccine data and discover novel scientific insights. Key components of VIOLIN include various vaccine component databases (e.g., Protegen vaccine antigen knowledgebase, Vaxjo vaccine adjuvant database), knowledgebases for specific diseases such as CanVaxKB for cancers and Cov19VaxKB for COVID-19, vaccine immune factor database (VaximmutorDB) and associated gene expression analysis tool (i.g., VIGET), and vaccine literature search (VO-SciMiner), and vaccine design tool (Vaxign2). These tools facilitate the discovery of mechanistic patterns integral to protective antigens and effective vaccine-induced immune response. The Vaccine Ontology is employed to ensure standardization and integration within VIOLIN, which also hosts other ontologies, such as the Ontology of Vaccine Adverse Events (OVAE) and Vaccine Investigation Ontology (VIO). Collectively, VIOLIN stands as a robust and holistic hub for vaccine-related information.","['Data Integration', 'Ontologies', 'Data mining and knowledge discovery']"
124,Linking EHR Prescribing Data with Pharmacy Dispensing Records: A Method to Reduce Misclassification in Pediatric Antidepressant Prescriptions,Integrating Multi-Modal health Data to Enhance the Power of Informatics,"EHR based medication data are limited by only observing prescription information. We developed an approach to link prescription data with fills data from SureScripts. Using pediatric antidepressant prescriptions as a use case, we assessed factors associated with fill completion and impact of using prescribed vs filled data in downstream analyses. 78% of children filled their prescription with demographic and clinical differences observed. Medication definition impacted downstream inference.","['Data/system integration, standardization and interoperability', 'Outcomes research, clinical epidemiology, population health', 'Drug discovery, repurposing, and side-effect discovery']"
125,Assessing the Impact of Activity Levels on Weight Change in Individuals with Obesity: Addressing Analytic Challenges in User Tracking Data,"Telehealth, Wearable Devices, and Patient-Generated Health Data: The New Frontiers of Informatics","In a study of 368 individuals with obesity, we integrated Fitbit data with electronic health records (EHR) to analyze weight change in relation to activity levels. Challenges arose in defining data completeness for Fitbit users. Results revealed a positive correlation between activity intensity and weight loss, that was relatively robust to completeness definitions. The study emphasized both the potential and challenges of utilizing the tracking data to monitor weight change.","['Data Integration', 'EHR-based phenotyping', 'Mobile Health, wearable devices and patient-generated health data']"
126,Prevalence of Racial Disparity in the Performance of Prediction Models for Teenage Hospitalization,Fairness and Disparity in Health and Biomedical Informatics: Addressing Inequities through Innovation,Racial biases associated with AI algorithms threaten to perpetuate the cycle of health disparity. A knowledge gap in AI fairness research in medicine comes from the lack of assessment of the prevalence of racial biases in health risk prediction models. This study trained models to predict teenage hospitalization using different sampling and learning algorithms. Our analyses found racial disparities in model performance to be common but not statistically significant.,"['Machine learning and predictive modeling', 'Ethical, legal, and social issues', 'Outcomes research, clinical epidemiology, population health']"
127,Conditions for Enhanced Rare Event Prediction with Multi-Label Learning,,"The application of deep learning models for rare disease prediction faces formidable challenges due to data scarcity and class imbalances. This study explores the potential of multi-label learning as a strategy to improve rare event predictions. Using synthetic datasets, we experimentally investigate the usage conditions for multi-label learning efficacy, revealing promising but nonlinear performance improvement with higher event relevance and secondary event rates. The findings lay groundwork for more targeted applications of multi-label learning for rare diseases.","['Reproducible research methods and tools', 'Data commons', 'Machine learning and predictive modeling']"
128,Trustworthy Artificial Intelligence in Patient-Centered Outcomes Research,,The Department of Health and Human Services Office of the Assistant Secretary for Planning and Evaluation aims to promote Trustworthy Artificial Intelligence in its portfolio of intradepartmental projects that build data capacity for patient-centered outcomes research (PCOR). An environmental scan and key informant semi-structured discussions with experts in AI were conducted to gather information on the implementation of Trustworthy AI principles in the context of PCOR and other healthcare research.,"['Patient centered research and care', 'Ethical, legal, and social issues', 'Outcomes research, clinical epidemiology, population health']"
129,Detecting Favorable Effect of Combination Therapies on cardiotoxicity,Real-World Evidence in Informatics: Bridging the Gap between Research and Practice,"Drug-induced cardiotoxicity represents a significant risk to patients, particularly when it results in lasting harm to the heart muscle. To mitigate risks and enhance treatment outcomes, combination therapies have gained attraction, offering the promise of increased efficacy, and reduced toxicity, with the underlying rationale of reducing required drug concentrations of individual drugs and poly-pharmacological effects. In this study, we proposed a systematic workflow aimed at detecting the favorable effect of combination therapies on cardiotoxicity, leveraging the data from the Food and Drug Administration Adverse Event Reporting System (FAERS), a valuable resource that compiles real-world, spontaneous reports of adverse drug events. We first identified 751 drugs with signals of cardiotoxicity from the AERS-DM based on the rationale of contrasting all the system organ class (SOC) level AEs of any drug in the AERS-DM. We then compared cardiotoxicity signals of drugs of interest between the scenarios of single drug uses and drug combinations. Results showed that out of the 751 drugs, 144 of them exhibited no signals of cardiotoxicity when used together in 1,153 different drug-drug combinations. Ad hoc validation was done for doxorubicin. The drug-drug pairs potentially mitigating cardiotoxicity can be freely accessible at https://github.com/OHNLP/Cardiotoxicity. In the future, we will prepare a knowledge-enhanced dataset for all available FAERS data and further validate the potential favorable effects of drug-drug pairs systematically.","['Public health informatics', 'Drug discovery, repurposing, and side-effect discovery', 'Outcomes research, clinical epidemiology, population health']"
130,Generating and Validating a Multi-Health System Pipeline to Obtain Social Drivers of Health Data,Fairness and Disparity in Health and Biomedical Informatics: Addressing Inequities through Innovation,"There is a growing interest in linking external social drivers of health (SDOH) with electronic health record (EHR) data to understand how upstream factors may impact health. We developed a generalizable pipeline featuring DeGAUSS, an open-source geocoding tool, to enable acquisition and sharing of neighborhood-level SDOH data for patients from multiple health systems. In addition, we performed a validation of the geocoding results of DeGAUSS against a private third-party vendor. The pipeline was successfully implemented on a cohort of Duke patients resulting in SDOH data obtained for 98.0% of addresses. There was low disagreement (high concordance) between DeGAUSS and the third-party vendor FIPS assignments: 6.7% and 4.6% disagreement at the census block group and tract levels, respectively. At the census tract level, there were no significant differences in percent disagreement in FIPS classification among urban/rural strata, years, or ADI quintiles. However, disagreement proportion differed significantly by year and by urban/rural category at the census block group level, with larger disagreement in the rural category than in both micropolitan and metropolitan categories. This suggests that geocoding error present at this scale can be problematic. Our flexible data pipeline can facilitate the acquisition of location-based SDOH in a secure way that is suitable for cross-health system sharing. We are currently validating the pipeline in a multicenter research consortium, and in other surgical populations.","['Social determinants of health', 'Data sharing / interoperability', 'Clinical and research data collection, curation, preservation, or sharing']"
